{
  "$schema": "https://json-schema.org/draft/2020-12/schema",
  "$id": "https://woodshop.dev/schemas/create_project.output.json",
  "title": "CreateProjectOutput",
  "type": "object",
  "additionalProperties": false,
  "properties": {
    "project_id": {
      "allOf": [
        { "$ref": "./common.schema.json#/$defs/projectId" }
      ],
      "description": "Stable identifier derived from inputs"
    },
    "units": {
      "type": "string",
      "enum": ["mm", "inch"],
      "description": "Units echoed from input"
    },
    "template": {
      "type": ["string", "null"],
      "description": "Template selection, if any"
    },
    "materials": {
      "type": "array",
      "description": "Default material catalog for the project",
      "items": { "$ref": "./common.schema.json#/$defs/materialsItem" }
    },
    "seed": {
      "allOf": [
        { "$ref": "./common.schema.json#/$defs/seedOutput" }
      ],
      "description": "Seed used for deterministic operations"
    },
    "engine_versions": { "$ref": "./common.schema.json#/$defs/engineVersions" },
    "revision_id": {
      "allOf": [
        { "$ref": "./common.schema.json#/$defs/revisionId" }
      ],
      "description": "Current git revision"
    },
    "inputs_hash": {
      "allOf": [
        { "$ref": "./common.schema.json#/$defs/inputsHash" }
      ],
      "description": "SHA-256 hash of validated inputs"
    }
  },
  "required": [
    "project_id",
    "units",
    "template",
    "materials",
    "seed",
    "engine_versions",
    "revision_id",
    "inputs_hash"
  ]
}
